{
  "task_number": 13,
  "topic_code": "NET-IP",
  "topic_name": "Адресация в Интернете",
  "difficulty_level": 8,
  "difficulty_label": "hard",
  "prototype": {
    "text": "<p>Сеть задана IP-адресом <strong>122.159.136.144</strong> и маской сети <strong>255.255.255.248</strong>.</p><p>Сколько в этой сети IP-адресов, для которых количество единиц в двоичной записи IP-адреса <strong>не кратно 4</strong>?</p><p>В ответе укажите только число.</p>",
    "input_format": "Целое число",
    "answer_format": "int",
    "attached_files": [],
    "images": []
  },
  "solution": {
    "steps": [
      {
        "step": 1,
        "explanation": "Создаем сеть с помощью `ipaddress`. Важно: в условии дан 'IP-адрес и маска', а не 'Адрес сети'. Но для `ip_network` это неважно, главное указать `strict=False`.",
        "code": "import ipaddress\n\n# Создаем объект сети\nnet = ipaddress.ip_network('122.159.136.144/255.255.255.248', strict=False)"
      },
      {
        "step": 2,
        "explanation": "Перебираем все адреса в сети и проверяем условие.",
        "code": "count = 0\nfor ip in net:\n    # Преобразуем IP в число, затем в двоичную строку\n    # bin(int(ip)) даст '0b111...'\n    binary_ip = bin(int(ip))[2:]\n    \n    # Считаем единицы\n    ones = binary_ip.count('1')\n    \n    # Проверяем условие 'не кратно 4'\n    if ones % 4 != 0:\n        count += 1\nprint(count)"
      },
      {
        "step": 3,
        "explanation": "Маска 255.255.255.248. \n248 = 11111000. В конце 3 нуля. \nВсего адресов $2^3 = 8$. \nЭто очень маленькая сеть, перебор мгновенный."
      }
    ],
    "variants": [
      {
        "name": "Решение программой (Python)",
        "steps": [
          {
            "step": 1,
            "explanation": "Полный код решения.",
            "code": "import ipaddress\n\nnet = ipaddress.ip_network('122.159.136.144/255.255.255.248', strict=False)\ncount = 0\nfor ip in net:\n    if bin(int(ip)).count('1') % 4 != 0:\n        count += 1\nprint(count)"
          }
        ]
      },
      {
        "name": "Ручной способ",
        "steps": [
          {
            "step": 1,
            "explanation": "Маска ...248. Это 3 бита на хост. Адреса меняются в диапазоне от ...000 до ...111 (8 штук)."
          },
          {
            "step": 2,
            "explanation": "Найдем адрес сети: 144 & 248. \n144 = 10010000.\n248 = 11111000.\nAND = 10010000 (144). \nДиапазон адресов: 122.159.136.144 ... 122.159.136.151."
          },
          {
            "step": 3,
            "explanation": "Нужно посчитать единицы в фиксированной части (122.159.136) + единицы в последнем байте (144..151).\n122 = 01111010 (5 ед)\n159 = 10011111 (6 ед)\n136 = 10001000 (2 ед)\nСумма const = 5+6+2 = 13 единиц."
          },
          {
            "step": 4,
            "explanation": "Последний байт: \n144 (10010000) -> 2 ед. Всего 13+2=15. (Не кратно 4? Да).\n145 (10010001) -> 3 ед. Всего 16. (Кратно 4? Да - не подходит).\n... и так далее для 8 чисел."
          }
        ]
      }
    ],
    "alternative_methods": ["Ручной подсчет суммы бит"],
    "common_mistakes": [
      "Забыли про неизменяемую часть адреса (первые 3 байта).",
      "Ошиблись в подсчете единиц вручную."
    ],
    "time_estimate_sec": 240
  },
  "answer": "5",
  "hint_ladder": [
    {
      "level": 1,
      "text": "Определи количество адресов в сети (по числу нулей в маске)."
    },
    {
      "level": 2,
      "text": "Используй цикл `for ip in network` в Python для перебора."
    },
    {
      "level": 3,
      "text": "Функция `bin(int(ip)).count('1')` поможет найти количество единиц."
    }
  ],
  "tags": ["ip", "подсчет", "python"],
  "source": "Demo 2025",
  "meta": {}
}