{
  "task_number": 2,
  "topic_code": "LOGIC-TRUTH",
  "topic_name": "Таблицы истинности",
  "difficulty_level": 9,
  "difficulty_label": "hard",
  "prototype": {
    "text": "<p>Логическая функция <em>F</em> задаётся выражением: <strong>(x ≡ ¬y) → ((x ∧ w) ≡ z)</strong>.</p><p>Приведён фрагмент таблицы истинности для F=0. Фрагмент содержит 3 строки.</p><table border='1'><tr><th>?</th><th>?</th><th>?</th><th>?</th></tr><tr><td></td><td>1</td><td></td><td></td></tr><tr><td></td><td></td><td>1</td><td></td></tr><tr><td>1</td><td></td><td></td><td>1</td></tr></table><p>Определите порядок переменных.</p>",
    "input_format": "Строка из букв",
    "answer_format": "string",
    "attached_files": [],
    "images": []
  },
  "solution": {
    "steps": [
      {
        "step": 1,
        "explanation": "Генерируем таблицу истинности для ложного значения функции (F=False). В Python используем `<=` для импликации.",
        "code": "print('x y z w')\nfor x in range(2):\n    for y in range(2):\n        for z in range(2):\n            for w in range(2):\n                # (x ≡ ¬y) → ((x ∧ w) ≡ z)\n                # Левая часть: x == (not y)\n                # Правая часть: (x and w) == z\n                left = (x == (not y))\n                right = ((x and w) == z)\n                \n                if (left <= right) == False:\n                     print(x, y, z, w)"
      },
      {
        "step": 2,
        "explanation": "Вывод программы даст 3 строки. Выпишем их и проанализируем. Заметим, что левая часть импликации (x ≡ ¬y) обязана быть Истиной (1), чтобы вся импликация была Ложью."
      },
      {
        "step": 3,
        "explanation": "Ищем в таблице задания два столбца, которые ни в одной строке не имеют одинаковых значений (с учетом того, что пустые клетки могут быть чем угодно, но противоречий быть не должно)."
      }
    ],
    "variants": [
      {
        "name": "Ручной способ (Аналитический)",
        "steps": [
          {
            "step": 1,
            "explanation": "Импликация A → B ложна тогда и только тогда, когда A=1 и B=0."
          },
          {
            "step": 2,
            "explanation": "A = (x ≡ ¬y) = 1. Это значит, что x ≠ y. Переменные x и y всегда имеют разные значения (0 и 1 или 1 и 0)."
          },
          {
            "step": 3,
            "explanation": "B = ((x ∧ w) ≡ z) = 0. Значит (x ∧ w) ≠ z. Рассмотрим случаи.\nЕсли x=0, то (0 ∧ w) = 0. Значит 0 ≠ z, следовательно z=1. При этом y=1 (т.к. x≠y). W может быть любым (0/1). Получаем строки: 0 1 1 0, 0 1 1 1."
          },
          {
            "step": 4,
            "explanation": "Если x=1, то (1 ∧ w) ≠ z. При этом y=0.\nЕсли w=0, то 0 ≠ z -> z=1. Строка: 1 0 1 0.\nЕсли w=1, то 1 ≠ z -> z=0. Строка: 1 0 0 1.\nИтого имеем 4 строки-кандидата, нужно отобрать те, что дают F=0, и сопоставить с таблицей."
          }
        ]
      }
    ],
    "alternative_methods": ["Ручной способ"],
    "common_mistakes": [
      "Ошибка в приоритете операций (нужны скобки вокруг == и <=).",
      "Не учли, что x и y всегда противоположны."
    ],
    "time_estimate_sec": 420
  },
  "answer": "wzyx",
  "hint_ladder": [
    {
      "level": 1,
      "text": "Для получения F=0, условие (x ≡ ¬y) должно быть Истиной, а ((x ∧ w) ≡ z) - Ложью."
    },
    {
      "level": 2,
      "text": "Из (x ≡ ¬y) следует, что x и y всегда имеют разные значения. Найди в таблице два столбца, которые никогда не совпадают."
    },
    {
      "level": 3,
      "text": "Напиши код и выведи таблицу. Сравни строки с фрагментом."
    }
  ],
  "tags": ["логика", "импликация", "python"],
  "source": "Statgrad Hard",
  "meta": {}
}