{
  "task_number": 7,
  "topic_code": "INFO-MEDIA",
  "topic_name": "Кодирование графической информации",
  "difficulty_level": 3,
  "difficulty_label": "easy",
  "prototype": {
    "text": "<p>Какой минимальный объём памяти (в Кбайт) нужно зарезервировать, чтобы можно было сохранить любое растровое изображение размером <strong>320×240</strong> пикселей при условии, что в изображении могут использоваться <strong>256</strong> различных цветов? В ответе запишите только целое число.</p>",
    "input_format": "Целое число",
    "answer_format": "int",
    "attached_files": [],
    "images": []
  },
  "solution": {
    "steps": [
      {
        "step": 1,
        "explanation": "Сначала определим глубину цвета (i). По формуле Хартли: $N = 2^i$. У нас N = 256 цветов. 256 = 2^8, значит i = 8 бит на пиксель.",
        "code": "import math\nN = 256\ni = int(math.log2(N))\nprint(f\"Глубина цвета: {i} бит\")"
      },
      {
        "step": 2,
        "explanation": "Вычислим общий объем в битах: $V = x \\cdot y \\cdot i$. Размеры 320x240.",
        "code": "x = 320\ny = 240\nV_bits = x * y * i\nprint(f\"Объем в битах: {V_bits}\")"
      },
      {
        "step": 3,
        "explanation": "Переведем биты в Кбайты. \n1 байт = 8 бит.\n1 Кбайт = 1024 байта.\nСначала делим на 8, потом на 1024.",
        "code": "V_bytes = V_bits / 8\nV_kb = V_bytes / 1024\nprint(f\"Объем в Кбайт: {V_kb}\")"
      }
    ],
    "variants": [
      {
        "name": "Решение программой (Python)",
        "steps": [
          {
            "step": 1,
            "explanation": "Простой скрипт для расчета.",
            "code": "import math\n# Дано\nx = 320\ny = 240\nN = 256\n\n# Глубина цвета\ni = math.ceil(math.log2(N))\n\n# Объем\nV_bits = x * y * i\nV_kb = V_bits / 8 / 1024\n\nprint(V_kb)"
          }
        ]
      },
      {
        "name": "Ручной способ",
        "steps": [
          {
            "step": 1,
            "explanation": "i = log2(256) = 8 бит = 1 байт."
          },
          {
            "step": 2,
            "explanation": "Объем V = 320 * 240 * 1 байт. \nДля перевода в Кбайт делим на 1024. \n320 * 240 / 1024.\nСократим: 320 = 10 * 32, 240 = 240.\nИли просто: 76800 байт / 1024 = 75 Кбайт."
          }
        ]
      }
    ],
    "alternative_methods": ["Калькулятор"],
    "common_mistakes": [
      "Забыли перевести биты в байты перед переводом в Кбайты.",
      "Использовали 1000 вместо 1024 для Кбайта."
    ],
    "time_estimate_sec": 120
  },
  "answer": "75",
  "hint_ladder": [
    {
      "level": 1,
      "text": "Найди глубину цвета i. Сколько бит нужно, чтобы закодировать 256 вариантов? (2 в какой степени равно 256?)"
    },
    {
      "level": 2,
      "text": "Умножь количество пикселей (320*240) на глубину цвета (8 бит). Получишь объем в битах."
    },
    {
      "level": 3,
      "text": "Переведи биты в Кбайты: раздели на 8 (получишь байты), а затем на 1024."
    }
  ],
  "tags": ["кодирование", "изображения", "формула"],
  "source": "FIPI Base",
  "meta": {}
}