{
  "task_number": 14,
  "topic_code": "NUM-SYSTEMS",
  "topic_name": "Позиционные системы счисления",
  "difficulty_level": 3,
  "difficulty_label": "easy",
  "prototype": {
    "text": "<p>Значение арифметического выражения: $3 \\cdot 216^{1150} + 2 \\cdot 36^{1200} - 6^{1180} - 8$ записали в системе счисления с основанием <strong>6</strong>.</p><p>Сколько цифр <strong>5</strong> содержится в этой записи?</p>",
    "input_format": "Целое число",
    "answer_format": "int",
    "attached_files": [],
    "images": []
  },
  "solution": {
    "steps": [
      {
        "step": 1,
        "explanation": "Вычислим значение выражения в Python. Python автоматически поддерживает длинную арифметику (числа любой величины), поэтому можно просто записать формулу.",
        "code": "n = 3 * 216**1150 + 2 * 36**1200 - 6**1180 - 8"
      },
      {
        "step": 2,
        "explanation": "Нужно перевести число в 6-ричную систему и посчитать цифры '5'. Мы можем не переводить число в строку целиком, а просто делить его на 6 в цикле и проверять остатки.",
        "code": "count = 0\ntemp_n = n\nwhile temp_n > 0:\n    digit = temp_n % 6\n    if digit == 5:\n        count += 1\n    temp_n //= 6\nprint(count)"
      }
    ],
    "variants": [
      {
        "name": "Решение программой (Python)",
        "steps": [
          {
            "step": 1,
            "explanation": "Полный код решения.",
            "code": "n = 3 * 216**1150 + 2 * 36**1200 - 6**1180 - 8\ncount = 0\nwhile n > 0:\n    if n % 6 == 5:\n        count += 1\n    n //= 6\nprint(count)"
          }
        ]
      },
      {
        "name": "Ручной способ (Степени)",
        "steps": [
          {
            "step": 1,
            "explanation": "Приведем все к основанию 6. \n$216 = 6^3$, $36 = 6^2$.\nВыражение: $3 \\cdot (6^3)^{1150} + 2 \\cdot (6^2)^{1200} - 6^{1180} - (6 + 2)$.\n$3 \\cdot 6^{3450} + 2 \\cdot 6^{2400} - 6^{1180} - 6^1 - 2 \\cdot 6^0$."
          },
          {
            "step": 2,
            "explanation": "Это задача на свойства записи $A \\cdot N^k$. В 6-ричной системе $3 \\cdot 6^{3450}$ выглядит как цифра 3 и 3450 нулей. \nВычитание $6^{1180}$ из большего числа ($2 \\cdot 6^{2400}$) даст блок пятерок. \nКоличество пятерок при вычитании $a \\cdot 6^n - b \\cdot 6^m$ равно $n - m$ (если $a, b$ простые). \nТут сложнее из-за коэффициентов и хвоста (-8). Проще решить программно."
          }
        ]
      }
    ],
    "alternative_methods": ["Аналитический метод (приведение степеней)"],
    "common_mistakes": [
      "Ошибки при переписывании степеней (лишний ноль).",
      "Забыли, что `n % 6` дает цифру в 6-ричной системе (остаток)."
    ],
    "time_estimate_sec": 120
  },
  "answer": "1220",
  "hint_ladder": [
    {
      "level": 1,
      "text": "В Python можно возводить в степень оператором `**`. Вычисли выражение напрямую."
    },
    {
      "level": 2,
      "text": "Чтобы получить цифры числа в 6-ричной системе, используй цикл `while n > 0` и бери остаток от деления на 6 (`n % 6`)."
    },
    {
      "level": 3,
      "text": "Внутри цикла проверяй, равен ли остаток 5, и увеличивай счетчик."
    }
  ],
  "tags": ["системы счисления", "длинная арифметика", "python"],
  "source": "FIPI Base",
  "meta": {}
}