{
  "task_number": 26,
  "topic_code": "ALG-GREEDY",
  "topic_name": "Обработка данных (сортировка)",
  "difficulty_level": 6,
  "difficulty_label": "medium",
  "prototype": {
    "text": "<p>В файле содержится информация о заявках на проведение мероприятий в конференц-зале. Для каждой заявки указаны время начала и время окончания. В один момент времени может проходить только одно мероприятие (интервалы не должны пересекаться, границы могут касаться).</p><p>Определите максимальное количество мероприятий, которые можно провести.</p>",
    "input_format": "Файл .txt (N строк: start end)",
    "answer_format": "int",
    "attached_files": ["attachments/26_events.txt"],
    "images": []
  },
  "solution": {
    "steps": [
      {
        "step": 1,
        "explanation": "Классическая задача на выбор отрезков. Жадный алгоритм: всегда выгоднее выбирать мероприятие, которое <strong>заканчивается раньше всех</strong> (чтобы оставить больше места для следующих).",
        "code": "events = []\nwith open('26_events.txt') as f:\n    n = int(f.readline())\n    for line in f:\n        start, end = map(int, line.split())\n        events.append((start, end))\n\n# Сортируем по времени ОКОНЧАНИЯ (второй элемент кортежа)\nevents.sort(key=lambda x: x[1])"
      },
      {
        "step": 2,
        "explanation": "Проходим по списку и берем заявку, если она не пересекается с предыдущей взятой.",
        "code": "count = 0\nlast_end = -1\n\nfor start, end in events:\n    if start >= last_end: # Если начало >= конца предыдущего\n        count += 1\n        last_end = end # Обновляем время окончания\n\nprint(count)"
      }
    ],
    "variants": [
      {
        "name": "Решение программой (Python)",
        "steps": [
          {
            "step": 1,
            "explanation": "Код выше.",
            "code": "# См. Solution"
          }
        ]
      },
      {
        "name": "Решение в Excel",
        "steps": [
          {
            "step": 1,
            "explanation": "Запишите Start в столбец A, End в столбец B."
          },
          {
            "step": 2,
            "explanation": "Отсортируйте таблицу ПО СТОЛБЦУ B (End) по возрастанию."
          },
          {
            "step": 3,
            "explanation": "В столбце C (взяли/не взяли) пишем формулу. \nC1 = 1 (первое всегда берем).\nC2 = ЕСЛИ(A2 >= (время окончания последнего взятого); 1; 0).\nВ Excel сложно ссылаться на 'последнего взятого'. Нужно либо VBA, либо ручной спуск с проверкой. \nПроще Python."
          }
        ]
      }
    ],
    "alternative_methods": ["Excel (с трудом)"],
    "common_mistakes": [
      "Сортируют по времени НАЧАЛА (это ошибка, жадность так не работает).",
      "Забывают про условие касания границ (start >= end или start > end)."
    ],
    "time_estimate_sec": 360
  },
  "answer": "100",
  "hint_ladder": [
    {
      "level": 1,
      "text": "Это задача на жадный выбор. Выгоднее всего брать мероприятие, которое освободит зал раньше всех."
    },
    {
      "level": 2,
      "text": "Сортируй заявки по времени ОКОНЧАНИЯ (второе число)."
    },
    {
      "level": 3,
      "text": "Иди по отсортированному списку и бери заявку, если её начало >= времени окончания последней взятой."
    }
  ],
  "tags": ["сортировка", "интервалы", "python"],
  "source": "FIPI Standard",
  "meta": {}
}