{
  "task_number": 12,
  "topic_code": "ALG-TURING",
  "topic_name": "Машина Тьюринга",
  "difficulty_level": 8,
  "difficulty_label": "hard",
  "prototype": {
    "text": "<p>Дана программа. Начало q1, слева. Вход: число <strong>205</strong>. Машина стирает символы, заменяя их на λ (пусто), и движется вправо.</p><pre>q1, 1 -> λ, R, q2\nq1, 0 -> λ, R, q1\nq1, λ -> 0, N, q0\n\nq2, 1 -> λ, R, q1\nq2, 0 -> λ, R, q2\nq2, λ -> 1, N, q0</pre><p>Какой результат (число 0 или 1) останется на ленте?</p>",
    "input_format": "Целое число",
    "answer_format": "int",
    "attached_files": [],
    "images": []
  },
  "solution": {
    "steps": [
      {
        "step": 1,
        "explanation": "205 -> 11001101. Эмулируем.",
        "code": "# Вставляем класс TuringMachine\n# ...\n\nrules = {\n    ('q1', '1'): ('λ', 'R', 'q2'),\n    ('q1', '0'): ('λ', 'R', 'q1'),\n    ('q1', 'λ'): ('0', 'N', 'q0'),\n    ('q2', '1'): ('λ', 'R', 'q1'),\n    ('q2', '0'): ('λ', 'R', 'q2'),\n    ('q2', 'λ'): ('1', 'N', 'q0')\n}\n\ntm = TuringMachine(rules, bin(205)[2:], blank='λ', start_state='q1', accept_states=('q0',))\ntm.run()\nprint(tm.get_tape_str())"
      }
    ],
    "variants": [
      {
        "name": "Ручная трассировка",
        "steps": [
          {
            "step": 1,
            "explanation": "Анализируем логику: q1 — состояние 'четное число единиц' (начало). q2 — 'нечетное'."
          },
          {
            "step": 2,
            "explanation": "Если видим '1': q1->q2 или q2->q1 (состояние меняется). Если '0': состояние не меняется."
          },
          {
            "step": 3,
            "explanation": "В конце (на λ): если q1 (четное) -> пишем 0. Если q2 (нечетное) -> пишем 1."
          },
          {
            "step": 4,
            "explanation": "Число 205 (11001101) содержит 5 единиц. 5 — нечетное. Значит, остановимся в q2 и запишем 1."
          }
        ]
      }
    ],
    "alternative_methods": ["Эмулятор"],
    "common_mistakes": ["Ошибки в бинарном представлении."],
    "time_estimate_sec": 300
  },
  "answer": "1",
  "hint_ladder": [
    {
      "level": 1,
      "text": "Машина считает четность единиц. Используй эмулятор для проверки."
    }
  ],
  "tags": ["машина тьюринга", "четность"],
  "source": "Statgrad New",
  "meta": {}
}