{
  "task_number": 16,
  "topic_code": "ALG-RECURSION",
  "topic_name": "Рекурсивные алгоритмы",
  "difficulty_level": 3,
  "difficulty_label": "easy",
  "prototype": {
    "text": "<p>Алгоритм вычисления значения функции $F(n)$, где $n$ — натуральное число, задан следующими соотношениями:</p><p>$F(n) = 1$, если $n = 1$;</p><p>$F(n) = n \\cdot F(n-1)$, если $n > 1$.</p><p>Чему равно значение выражения $(F(2024) - F(2023)) / F(2022)$? В ответе запишите только целое число.</p>",
    "input_format": "Целое число",
    "answer_format": "int",
    "attached_files": [],
    "images": []
  },
  "solution": {
    "steps": [
      {
        "step": 1,
        "explanation": "Запишем функцию на Python. Так как числа большие (факториал 2024!), нам обязательно нужно увеличить лимит рекурсии.",
        "code": "import sys\nsys.setrecursionlimit(3000) # Лимит > 2024\n\ndef F(n):\n    if n == 1:\n        return 1\n    else:\n        return n * F(n - 1)"
      },
      {
        "step": 2,
        "explanation": "Вычислим выражение. Деление должно быть целочисленным (`//`) или обычным (`/`), если результат целое. Здесь факториалы, результат будет огромным, но при делении сократится.",
        "code": "res = (F(2024) - F(2023)) // F(2022)\nprint(res)"
      }
    ],
    "variants": [
      {
        "name": "Решение программой (Python)",
        "steps": [
          {
            "step": 1,
            "explanation": "Полный код.",
            "code": "import sys\nsys.setrecursionlimit(3000)\n\ndef F(n):\n    if n == 1: return 1\n    return n * F(n - 1)\n\n# (2024! - 2023!) / 2022!\n# = 2023! * (2024 - 1) / 2022! = 2023 * 2023\nprint((F(2024) - F(2023)) // F(2022))"
          }
        ]
      },
      {
        "name": "Ручной способ (Математика)",
        "steps": [
          {
            "step": 1,
            "explanation": "Функция $F(n) = n!$ (факториал).\nВыражение: $\\frac{2024! - 2023!}{2022!}$."
          },
          {
            "step": 2,
            "explanation": "Вынесем $2023!$ за скобки в числителе: $2023! \\cdot (2024 - 1) = 2023! \\cdot 2023$."
          },
          {
            "step": 3,
            "explanation": "Разделим на $2022!$. $\\frac{2023! \\cdot 2023}{2022!} = \\frac{2022! \\cdot 2023 \\cdot 2023}{2022!} = 2023 \\cdot 2023$."
          },
          {
            "step": 4,
            "explanation": "$2023^2 = 4092529$."
          }
        ]
      }
    ],
    "alternative_methods": ["Математическое упрощение"],
    "common_mistakes": [
      "Забыли `sys.setrecursionlimit` (получили RecursionError).",
      "Пытались вывести само число F(2024) (оно слишком огромное для консоли, хотя Python его посчитает)."
    ],
    "time_estimate_sec": 120
  },
  "answer": "4092529",
  "hint_ladder": [
    {
      "level": 1,
      "text": "Функция F(n) вычисляет факториал числа n."
    },
    {
      "level": 2,
      "text": "Для вычисления F(2024) в Python нужно увеличить лимит рекурсии: `sys.setrecursionlimit(3000)`."
    },
    {
      "level": 3,
      "text": "Математически: 2024! - 2023! можно упростить, вынеся 2023! за скобки."
    }
  ],
  "tags": ["рекурсия", "факториал", "python"],
  "source": "FIPI Base",
  "meta": {}
}