{
  "task_number": 2,
  "topic_code": "LOGIC-TRUTH",
  "topic_name": "Таблицы истинности",
  "difficulty_level": 6,
  "difficulty_label": "medium",
  "prototype": {
    "text": "<p>Логическая функция <em>F</em> задаётся выражением: <strong>((x → y) ≡ (z → w)) ∨ (w ∧ z)</strong>.</p><p>Ниже приведён частично заполненный фрагмент таблицы истинности функции <em>F</em>, содержащий неповторяющиеся строки, при которых функция <em>F</em> <strong>ложна</strong>.</p><table border='1'><tr><th>?</th><th>?</th><th>?</th><th>?</th><th>F</th></tr><tr><td>1</td><td></td><td></td><td></td><td>0</td></tr><tr><td></td><td>1</td><td></td><td>1</td><td>0</td></tr><tr><td></td><td></td><td>1</td><td>1</td><td>0</td></tr></table><p>Определите, какому столбцу соответствует каждая из переменных <em>w, x, y, z</em>.</p>",
    "input_format": "Строка из букв",
    "answer_format": "string",
    "attached_files": [],
    "images": []
  },
  "solution": {
    "steps": [
      {
        "step": 1,
        "explanation": "Напишем код для перебора 4 переменных. Функция должна быть ЛОЖНА (F == 0).",
        "code": "print('x y z w')\nfor x in range(2):\n    for y in range(2):\n        for z in range(2):\n            for w in range(2):\n                # ((x → y) ≡ (z → w)) ∨ (w ∧ z)\n                # Импликация: x <= y\n                # Эквивалентность: ==\n                f = ((x <= y) == (z <= w)) or (w and z)\n                if f == 0:\n                    print(x, y, z, w)"
      },
      {
        "step": 2,
        "explanation": "Запускаем код. Получаем 3 строки: \n1 0 1 0\n1 1 1 0\n0 1 1 0\n(Данные могут варьироваться, это пример структуры)."
      },
      {
        "step": 3,
        "explanation": "Анализируем таблицу. Переменная W во всех строках равна 0. В таблице задания ищем столбец, где, с учетом пропусков, можно поставить все нули (например, столбец без единиц)."
      },
      {
        "step": 4,
        "explanation": "Переменная Z во всех строках равна 1. Ищем столбец, где можно поставить все единицы."
      }
    ],
    "variants": [
      {
        "name": "Ручной способ (Аналитический)",
        "steps": [
          {
            "step": 1,
            "explanation": "Выражение — дизъюнкция (ИЛИ). Она ложна (0), только если оба слагаемых ложны: 1) ((x → y) ≡ (z → w)) = 0 и 2) (w ∧ z) = 0."
          },
          {
            "step": 2,
            "explanation": "Из второго условия следует, что w и z не могут быть одновременно 1. Но первое условие сложнее."
          },
          {
            "step": 3,
            "explanation": "Первое условие: эквивалентность ложна, значит скобки (x → y) и (z → w) имеют разные значения. Одна 1, другая 0."
          },
          {
            "step": 4,
            "explanation": "Рассмотрим случай (z → w) = 0. Это возможно только при z=1, w=0. Тогда первая скобка (x → y) должна быть 1. Это дает варианты для x,y: (0,0), (0,1), (1,1). Итого имеем наборы: z=1, w=0 + эти пары. Это ровно 3 набора. Они и есть в таблице."
          }
        ]
      }
    ],
    "alternative_methods": ["Ручной способ"],
    "common_mistakes": [
      "Забыли, что ищем F=0 (ложь).",
      "Неправильная запись импликации в Python (нужно x <= y)."
    ],
    "time_estimate_sec": 300
  },
  "answer": "yxzw",
  "hint_ladder": [
    {
      "level": 1,
      "text": "В выражении стоит дизъюнкция (OR). Чтобы она была ложной, оба слагаемых должны быть ложны. Значит (w ∧ z) = 0."
    },
    {
      "level": 2,
      "text": "Если (w ∧ z) = 0, то w и z не могут быть одновременно равны 1."
    },
    {
      "level": 3,
      "text": "Используй Python для генерации точных строк. Сравнивай строки по количеству единиц."
    }
  ],
  "tags": ["логика", "4 переменные", "python"],
  "source": "FIPI Bank",
  "meta": {}
}