{
  "task_number": 19,
  "topic_code": "GAME-THEORY-1",
  "topic_name": "Теория игр (1 куча)",
  "difficulty_level": 2,
  "difficulty_label": "easy",
  "series_id": "game_one_heap_classic",
  "series_task_numbers": [19, 20, 21],
  "prototype": {
    "text": "<p>Два игрока, Петя и Ваня, играют в игру. Перед игроками лежит куча камней. Игроки ходят по очереди, первый ход делает Петя.</p><p>За один ход игрок может добавить в кучу <strong>один камень</strong> или увеличить количество камней в куче <strong>в два раза</strong>.</p><p>Игра завершается, когда количество камней в куче становится <strong>не менее 29</strong>.</p><p>В начальный момент в куче было $S$ камней, $1 \\le S \\le 28$.</p><p><strong>Задание 19.</strong> Укажите такое значение $S$, при котором Петя не может выиграть за один ход, но при любом ходе Пети Ваня выигрывает своим первым ходом.</p><p><strong>Задание 20.</strong> Найдите два таких значения $S$, при которых у Пети есть выигрышная стратегия, причём Петя не может выиграть за один ход, но может выиграть своим вторым ходом.</p><p><strong>Задание 21.</strong> Найдите значение $S$, при котором у Вани есть выигрышная стратегия, позволяющая ему выиграть первым или вторым ходом при любой игре Пети, но нет стратегии, которая гарантированно позволит выиграть первым ходом.</p>",
    "input_format": "Три значения (строка или числа)",
    "answer_format": "string",
    "attached_files": [],
    "images": []
  },
  "solution": {
    "steps": [
      {
        "step": 1,
        "explanation": "Решим задачу, используя рекурсивную функцию на Python. Определим функцию `f(s, m)`, где `s` - количество камней, `m` - счетчик ходов (глубина).",
        "code": "from functools import lru_cache\n\ndef moves(s):\n    return (s + 1, s * 2)\n\n@lru_cache(None)\ndef f(s):\n    # Если победа достигнута (>= 29), возвращаем 'Win' (0 шагов до победы)\n    # Но нам удобнее классифицировать позиции.\n    # Используем простую логику: \n    # Если из s можно попасть в 'Lose', то s - это 'Win'.\n    # Если все ходы из s ведут в 'Win', то s - это 'Lose'.\n    if s >= 29: return 0\n    \n    # Получаем результаты для следующих ходов\n    next_res = [f(m) for m in moves(s)]\n    \n    # Если есть ход в позицию с отрицательным результатом (проигрыш для противника),\n    # то мы выигрываем за (abs(res) + 1) ходов.\n    # Обозначим: четные числа - выигрыш, нечетные - проигрыш (или наоборот).\n    # Лучше использовать стандартную схему из PDF: \n    # f(s, m): True/False (выигрывает ли текущий игрок).\n    pass"
      },
      {
        "step": 2,
        "explanation": "Код для определения 'расстояния до победы'.\nWin1 (Петя 1) -> 1\nLose1 (Ваня 1) -> 2\nWin2 (Петя 2) -> 3\nLose2 (Ваня 2) -> 4",
        "code": "def solve():\n    # Массив результатов для чисел от 1 до 29\n    # res[s] хранит: 1 (W1), 2 (L1), 3 (W2), 4 (L2)\n    res = [0] * 300\n    \n    for s in range(28, 0, -1):\n        m = [res[s+1], res[s*2]]\n        \n        # Логика: \n        # Если можно попасть в L (четное число в m) -> мы в W.\n        # Берем минимальное четное (быстрая победа) + 1.\n        loses = [x for x in m if x % 2 == 0 and x != 0] # x=0 это 'уже победа', не считается за ход\n        # Стоп, если s*2 >= 29, то res[s*2] должен быть 0. \n        # Тогда ход в 0 - это победа за 1 ход.\n        \n        # Перепишем чисто:\n        # Если есть ход в '0' (финиш), то это победа за 1 ход.\n        if any(x == 0 for x in [s+1, s*2] if x >= 29):\n             res[s] = 1\n             continue\n             \n        # Получаем значения для потомков (если они < 29)\n        # Если s*2 >= 29, это мы уже обработали (победа за 1 ход)\n        vals = []\n        for nxt in (s+1, s*2):\n            if nxt >= 29: vals.append(0) # Финиш\n            else: vals.append(res[nxt])\n            \n        # Стратегия\n        # 1. Можем ли выиграть? (попасть в четное/L)\n        loss_moves = [v for v in vals if v % 2 == 0]\n        if loss_moves:\n            res[s] = min(loss_moves) + 1\n        else:\n            # 2. Мы проигрываем (все ходы ведут в нечетное/W)\n            res[s] = max(vals) + 1\n            \n    # Вывод ответов\n    for s in range(1, 29):\n        if res[s] == 2: print(f'19: {s}')\n        if res[s] == 3: print(f'20: {s}')\n        if res[s] == 4: print(f'21: {s}')"
      }
    ],
    "variants": [
      {
        "name": "Решение программой (Python Rec)",
        "steps": [
          {
            "step": 1,
            "explanation": "Используем рекурсию с мемоизацией. Логика: если есть ход в позицию, где противник проигрывает (четное число ходов до финиша), то мы выигрываем (нечетное).",
            "code": "from functools import lru_cache\n\n@lru_cache(None)\ndef g(s):\n    if s >= 29: return 0\n    m = [g(s+1), g(s*2)]\n    # Если есть ход в 'проигрышную' для соперника (четную) позицию -> мы выигрываем\n    evens = [x for x in m if x % 2 == 0]\n    if evens: return min(evens) + 1\n    # Иначе мы проигрываем -> максимально тянем время\n    return max(m) + 1\n\nprint(\"19:\", [s for s in range(1, 29) if g(s) == 2])\nprint(\"20:\", [s for s in range(1, 29) if g(s) == 3])\nprint(\"21:\", [s for s in range(1, 29) if g(s) == 4])"
          }
        ]
      },
      {
        "name": "Решение в Excel",
        "steps": [
          {
            "step": 1,
            "explanation": "Заполняем столбец A числами от 1 до 28."
          },
          {
            "step": 2,
            "explanation": "Столбец B (Win1): `=ЕСЛИ(ИЛИ(A1+1>=29; A1*2>=29); 1; 0)`."
          },
          {
            "step": 3,
            "explanation": "Столбец C (Lose1 - Зад.19): `=ЕСЛИ(И(B(A1+1)=1; B(A1*2)=1); 1; 0)` (В Excel ссылки: `=ЕСЛИ(И(ВПР(A1+1...)=1; ...)` или просто смотрим на соседние ячейки)."
          },
          {
            "step": 4,
            "explanation": "Столбец D (Win2 - Зад.20): `=ЕСЛИ(ИЛИ(C(A1+1)=1; C(A1*2)=1); 1; 0)`."
          }
        ]
      }
    ],
    "alternative_methods": ["Дерево игры вручную"],
    "common_mistakes": [
      "В 19 задании находят позицию, где Петя выигрывает 1 ходом (а надо, чтобы Ваня).",
      "В 21 задании забывают, что Ваня может выиграть и 1-м ходом (условие '1 или 2')."
    ],
    "time_estimate_sec": 300
  },
  "answer": "19: 14; 20: 7, 13; 21: 12",
  "hint_ladder": [
    {
      "level": 1,
      "text": "Для задачи 19 найди число, из которого все ходы ведут в зону 'Победа за 1 ход' (>= 15)."
    },
    {
      "level": 2,
      "text": "Для задачи 20 найди числа, из которых можно попасть в число из задачи 19 (в 14)."
    },
    {
      "level": 3,
      "text": "Используй код на Python с функцией `g(s)`, которая возвращает дистанцию до победы."
    }
  ],
  "tags": ["теория игр", "одна куча", "python"],
  "source": "FIPI Base",
  "meta": {}
}