{
  "task_number": 11,
  "topic_code": "INFO-AMOUNT",
  "topic_name": "Вычисление количества информации",
  "difficulty_level": 8,
  "difficulty_label": "hard",
  "prototype": {
    "text": "<p>При регистрации в компьютерной системе каждому объекту присваивается идентификатор, состоящий из <strong>317</strong> символов. Для его формирования используются:</p><ul><li>десятичные цифры (10 символов);</li><li>специальный алфавит из <strong>4090</strong> символов.</li></ul><p>В базе данных для хранения каждого идентификатора отводится одинаковое и минимально возможное целое число <strong>байт</strong>. Используется посимвольное кодирование.</p><p>Определите объём памяти (в <strong>Мбайтах</strong>), необходимый для хранения <strong>262 144</strong> таких идентификаторов. В ответе запишите только целое число.</p>",
    "input_format": "Целое число",
    "answer_format": "int",
    "attached_files": [],
    "images": []
  },
  "solution": {
    "steps": [
      {
        "step": 1,
        "explanation": "Мощность алфавита $N = 10 + 4090 = 4100$. Найдем i: $2^i \\ge 4100$. $2^{12} = 4096$ (мало), $2^{13} = 8192$ (хватает). i = 13 бит.",
        "code": "import math\nN = 10 + 4090\ni = math.ceil(math.log2(N)) # 13"
      },
      {
        "step": 2,
        "explanation": "Объем одного ID в битах: $317 \\cdot 13 = 4121$ бит.",
        "code": "L = 317\nv_bits = L * i # 4121"
      },
      {
        "step": 3,
        "explanation": "Перевод в байты: $4121 / 8 = 515.125 \\to 516$ байт.",
        "code": "v_bytes = math.ceil(v_bits / 8) # 516"
      },
      {
        "step": 4,
        "explanation": "Общий объем: $516 \\cdot 262144$ байт. Переводим в Мбайты: делим на $1024^2$. $262144 = 2^{18}$, $1024^2 = 2^{20}$. $516 \\cdot 2^{18} / 2^{20} = 516 / 4 = 129$.",
        "code": "count = 262144\ntotal_bytes = v_bytes * count\ntotal_mb = total_bytes / (1024 * 1024)\nprint(int(total_mb))"
      }
    ],
    "variants": [
      {
        "name": "Ручной способ (Степени двойки)",
        "steps": [
          {
            "step": 1,
            "explanation": "N=4100 -> i=13 бит."
          },
          {
            "step": 2,
            "explanation": "ID = 317 * 13 = 4121 бит. В байтах: 4121/8 = 515.125 -> 516 байт."
          },
          {
            "step": 3,
            "explanation": "Всего = 516 * 262144. Заметим, что 262144 = 2^18 (так как 1024=2^10, 262тыс это 2^18). 1 Мбайт = 2^20 байт."
          },
          {
            "step": 4,
            "explanation": "Мбайты = (516 * 2^18) / 2^20 = 516 / 2^2 = 516 / 4 = 129."
          }
        ]
      }
    ],
    "alternative_methods": ["Калькулятор степеней"],
    "common_mistakes": [
      "Неверно определили i (взяли 12 бит вместо 13).",
      "Ошиблись при делении больших чисел вручную."
    ],
    "time_estimate_sec": 300
  },
  "answer": "129",
  "hint_ladder": [
    {
      "level": 1,
      "text": "Мощность алфавита 4100. Какая степень двойки ближайшая сверху? (2^12=4096, 2^13=8192)."
    },
    {
      "level": 2,
      "text": "Посчитай размер одного ID в байтах. Округли вверх."
    },
    {
      "level": 3,
      "text": "262144 — это 2 в 18-й степени. А 1 Мбайт — это 2 в 20-й степени байт. Сократи степени."
    }
  ],
  "tags": ["большие числа", "степени двойки", "python"],
  "source": "EGE PDF Task",
  "meta": {}
}